{
  "nome_dataset": "Atletas por gênero (Paris 2024)",
  "fonte": "Derivado do medallists.csv de Paris",
  "descricao": "Número de atletas únicos participantes, separados por gênero (Male/Female) nos Jogos de Paris 2024.",
  "campos_principais": [
    "gender",
    "num_atletas"
  ],
  "data_criacao": "2026-03-26",
  "observacoes": "Considera apenas atletas individuais registrados em medallists.csv. Equipes não são contabilizadas como atletas individuais."
}